key,x,y
FRIGORIFICOS DE OLOT SL EDAR OLOT,457959.61,4672318.58
"ULTPOMA, SL ULTPOMA",502541.0,4653162.0
"DUCFORM, SA DUCFORM, SA (EDAR CASSÀ DE LA SELVA)",486781.38,4635169.31
"JARDINERIA EL ROURE, SL JARDINERIA EL ROURE, SL",419522.0,4605206.0
"VIÑARTA CUSI, SILVIA SÍLVIA VIÑARTA CUSÍ (SORTIDA DEPURADORA)",377121.0,4586599.0
"FRANCOLÍ FARRÉ, ERNEST FRANCOLÍ FARRÉ, ERNEST (MAS ANGLADA DE DALT) (SORTIDA DEPURADORA)",437426.0,4656706.0
"AVIAGEN, SAU AVIAGEN, SAU",432963.12,4612892.68
"NELVI, SCP NELVI, SCP (ANTIC BATALLA SANT CRISTÒFOL, SL - SORTIDA DEPURADORA)",404587.02,4604439.88
"AGLANER ACTIVITATS, SL AGLANER ACTIVITATS, SL",406949.0,4641379.0
"TERMINALES QUÍMICOS, SA (TERQUIMSA I) TERQUIMSA, I: ABOCAMENT A MAR",351928.54,4552021.2
EDAR DE SANT FELIU SASSERRA EDAR SANT FELIU SASSERRA,419319.0,4643795.0
"FLINT GROUP IBERIA, SL ABOC.FLINT GROUP IBERIA, SA (ABANS BASF SISTEMAS DE IMPRESION SA)",440306.04,4600695.61
"CÀMPING ABADESSES, SL CAMPING ABADESSES SL (sortida depuradora)",444954.0,4677620.0
"MIRFER, SA MIRFER, SA_1",501151.0,4627093.0
"HERETAT VINYOLES, SLU HERETAT VINYOLES, SLU: INFILTRACIÓ EN EL TERRENY",441551.0,4656192.0
"LOGIVIT, SL LOGIVIT, SL",394175.88,4588484.94
"ENVASES DEL VALLES, SA Abocament - ENVASES DEL VALLES,SA- clavegueram i riu Mogent",449540.12,4609344.55
JUNTA COMP. SUBSECT. 1 Y 2 PLAN PARCIAL CAN BAGES POLÍGON INDUSTRIAL CAN BAGES (SORTIDA DEPURADORA),423877.04,4603914.74
"CAVAS CASTILLO DE PERALADA, SA EDAR PERALADA",501210.76,4683084.27
JORDI OLIVELLA CIVILL AA2003001513,386055.84,4585545.99
"LLAURADÓ MARTÍNEZ, JOSEP M. JOSEP M. LLAURADO MARTINEZ (LLERA)",325567.58,4562529.42
"AUTOPISTAS CONCESIONARIA ESPAÑOLA, SAU - PEATGE DE REUS AUTOPISTAS CONCESIONARIA ESPAÑOLA, SAU : BARRANC INNOMINAT",347140.0,4555605.0
UTE OLOST-OLVAN UTE OLOST-OLVAN,411896.41,4655349.91
JUNTA DE COMPENSACIÓ CAN COROMINES JUNTA DE COMPENSACIÓ CAN COROMINES (SORTIDA DEPURADORA),412459.0,4600036.82
"SANFEPLAST,SA SANFEPLAST-Riera de Relat",419088.34,4643847.83
"ALSINA BARCELÓ, RAMON  -MAS GIFREU- RAMON ALSINA BARCELO- SORTIDA DEPURADORA",492875.65,4670282.32
"CALVO OYA, PILAR CAL CIGRÓ (CALVO OYA, PILAR)",490465.0,4635972.0
"GRANJA PORTA, SCP GRANJA PORTA SCP (SORTIDA DEPURADORA)",406322.15,4621412.9
"VALLDI, SL VALLDI, SL BL20030266 (SORTIDA RESIDUALS)",429946.01,4598870.68
"AUTEMA, SA AUTEMA SA (SORTIDA EDIFICI MANTENIMENT + BOX DE RENTAT DEL PEATGE DE CASTELLBELL I EL VILAR)",405215.07,4611667.89
"RECUPERACIÓ DE PEDRERES, SL -DIPÒSIT CONTROLAT VACAMORTA- ABOCADOR VACAMORTA (SORTIDA AIGÜES PLUVIALS SEMINETES)",501837.49,4646390.21
"MOTEC, SA EDAR MONTCADA",432443.96,4591681.65
"SAICA NATUR, SL EDAR ABRERA",409840.0,4595603.0
"CASINO DE FIGARÓ PROPIEDAD CASINO DEL FIGARÓ, SL",439172.17,4618126.64
ASSOCIACIÓ RECREATIVA DE CARAVANISTES DE BARCELONA AA2002001654_x000D_,401005.91,4590895.89
MONSAMA S.C.C.L. EDAR MARTORELL,410693.94,4592621.82
"DR. TORRENTS, SA DR.TORRENTS, SA (RESIDUALS)",403543.81,4578002.85
"INDUSTRIAS CROMIC MILENIUM, SL INDUSTRIAS CROMIC MILENIUM, SL (SORTIDA RESIDUALS)",430858.95,4590674.66
"GRUPO FSM VERTISPANIA, SL GRUPO FSM VERTISPANIA SL_CAN CARRERES (SORTIDA TRACTAMENT)",416292.97,4596092.78
"VERALLIA SPAIN, SA SAINT GOBAIN VICASA, SA",344417.77,4583954.31
"MOLISPELT, SL - CAMPING L'ESPELT RIU TORT (MOLISPELT, SL)",411082.58,4677105.95
"PARBOMA, SL PARBOMA,SL (CAN CALAU)",482236.0,4638881.0
"SUPRAMETAL, S.A. EDAR MARTORELL",410693.94,4592621.82
CONSELL COMARCAL GARROTXA EDAR OLOT,457959.61,4672318.58
"ESCAYOLA MANUEL, ISIDRO ISIDRO ESCAYOLA MANUEL (SORTIDA AIGÜES RESIDUALS)",409022.16,4622285.88
"BODEGAS CA N'ESTELLA, SL EDAR MARTORELL",410693.94,4592621.82
"TOWA PHARMACEUTICAL EUROPE, S.L.U. LABORATORIOS DOCTOR ESTEVE SA (SORTIDA RESIDUALS)",435449.01,4597781.64
"RECOBRIMENTS ALBAREDA, SL AA2002001165-EDAR d'Abrera",407985.96,4596490.85
"IGSA ANOIA, SA IGSA  ANOIA, SL (EDAR MASQUEFA)",401797.94,4594578.89
EDAR L'ESTANY EDAR DE L'ESTANY,426563.0,4636758.0
"DEP. DE TREBALL,AFERS SOCIALS I FAMÍLIA -RES. PUIG D'EN ROCA DEPARTAMENT D'ACCIÓ SOCIAL I CIUTADANIA (SORTIDA FOSSA-FILTRE)",484641.48,4649384.35
FUNDACIÓ AMPANS AMPANS (SORTIDA DEPURADORA),395956.08,4614695.96
"LINARES TALLÓ, JORDI JORDI LINARES TALLÓ (SORTIDA DEPURADORA)",407350.07,4610600.87
"GESTORA DE SÒLS DE CATALUNYA, SA GESTORA DE SOLS DE CATALUNYA (PLUVIALS SEMINETES)",376396.99,4606434.1
"HERCA, SCCL HERCA, SCCL (SORTIDA TRACTAMENT)",396643.09,4616010.96
"HISITEX, SA EDAR D' IGUALADA (VILANOVA DEL CAMÍ)",387457.97,4602415.01
FUNDACIÓN PROYECTO Y VIDA FUNDACION PROYECTO Y VIDA,441408.33,4638541.66
"CERVERA CORTADA, MANEL (CAMPING MONTSENY) ABOC.CAMPING MONTSENY: 021993000050",449299.0,4624390.0
"AQA CHEMICALS, SL AQA CHEMICALS, SL (SORTIDA AIGÜES RESIDUALS)",431438.04,4602610.68
"TGB, SA TGB, SA (xarxa de clavegueram)",390390.95,4598173.98
"EMBYLENE, SL EDAR LA BISBAL D'EMPORDÀ",503064.49,4647242.2
"MIQUEL GARDELL, SA MIQUEL GARDELL, SA (AIGÜES DE PLUJA)",441536.63,4678170.72
"DOG EDUCAT, SL DOG EDUCAT, SL",402912.0,4622806.0
"HOLCIM (ESPAÑA), SA HOLCIM HORMIGONES, SA",414406.94,4591795.79
"HARRY EL LIMPIO, S.L EDAR RUBÍ",416674.93,4590339.77
"PLINSA, SL PLINSA, SL (SUD)",417090.0,4632053.0
"GUINART PARERA, MONTSERRAT MONTSERRAT GUINART PARERA (SORTIDA DEPURACIÓ)",447939.15,4612539.57
"DISMOL MASQUEFA, SL Abocament DISMOL MASQUEFA, SL - EDAR de Masquefa",401815.94,4594585.89
"PLINSA, SL PLINSA, SL (NORD)",417120.0,4632150.0
"TROQUELPACK, SL EDAR ABRERA",409840.0,4595603.0
"BRITLI, SL   -CÀMPING LAVA- CAMPING LAVA: sortida EDAR",462431.58,4666288.54
"GRAU, SA ABOCAMENT GRAU, S.A. (PROCÉS, SANITÀRIES, NETEGES I ALTRES)",422456.08,4608695.75
"LAVADEROS EUROPA, SL LAVADEROS EUROPA, SL",408958.94,4594006.83
"REIFENSA CATALUNYA, SL REIFENSA CATALUNYA, SL (SORTIDA RESIDUALS)",416950.9,4587180.76
"ESTAMBAÑO, SL EDAR RUBI",416668.93,4590130.77
"DEPUNT, SA EDAR D' IGUALADA (VILANOVA DEL CAMÍ)",387457.97,4602415.01
"RECUPERACIONES F. LÓPEZ 2001, SL RECUPERACIONES F.LÓPEZ 2001,SL",414105.93,4590495.79
"TRANSFORMACION EUROPEA DE RESIDUOS, SL EDAR MOIA",425501.23,4628058.76
"INYECTADOS DE PRECISION PERGOM, SL INYECTADOS DE PRECISIÓN PERGOM, SL (SORTIDA SANITÀRIES)",406212.96,4597330.86
"CENTRE HÍPIC 3 AIRES, SL CENTRE HÍPIC 3 AIRES, SL",399389.0,4615490.0
"SAINT-GOBAIN WEBER CEMARKSA, SA EDAR MONTCADA",432443.96,4591681.65
"NAVARRO PEREZ, ANGEL ANGEL NAVARRO PEREZ",438775.37,4644704.69
CLUB CARAVANING AQUA ALBA ABOC.3A FASE: CLUB CARAVANING AQUA ALBA,461425.0,4619092.0
CLUB CARAVANING AQUA ALBA ABOC.CEMENTIRI: CLUB CARAVANING AQUA ALBA,461879.0,4618882.0
"AIGUA D' ORA, SL CAMPING AIGUA D'ORA, SL",393306.45,4664415.06
"CAMPING DE GOSOL, S.A. CAMPING GOSOL",389713.54,4676055.11
"IBERABRASIVOS, SLL IBERABRASIVOS, S.L.L.",428666.08,4607270.71
"BOEHRINGER INGELHEIM ESPAÑA, SA BOEHRINGER INGELHEIM ESPAÑA, SA ( llera)",421431.0,4594248.0
"INDUSTRIA DE ACABADOS ESPECIALES SAMA, SL INDUSTRIA DE ACABADOS ESPECIALES SAMA, SL (AIGÜES SANITÀRIES)",405905.94,4593795.86
"PLANAS RIERA, GRISELDA GRISELDA PLANAS RIERA: FITODEPURACIÓ I INFILTRACIÓ TERRENY",383950.0,4606536.0
"AUSA CENTER, SLU EDAR DE MANRESA",403639.12,4617791.91
"PONT, AURELL Y ARMENGOL, SL PONT AURELL Y ARMENGOL (SORTIDA SANITARIES)",418365.03,4602797.78
"TALLERS MECANICS CASANOVA-CAPDEVILA, SL AA2003001338-clavegueram-riu Ter",438906.47,4656885.7
"RESTAURANT CAN NET, SL 022000000137",455797.19,4617171.51
"INDOCAR REUS, SCCL Abocament INDOCAR, SCCL - pou d'infiltració",341162.56,4557778.29
"ABELLO LINDE, SA ABELLO-Abocament",417415.94,4591320.77
"INSTITUCIÓ FAMILIAR D'EDUCACIÓ, SA (COL·LEGI LA VALL) ABOCAMENT COL·LEGI LA VALL",424298.98,4595986.72
"ECCOCIWINE, SL BLAU NOU, S.L  (SORTIDA DEPURADORA)",494732.5,4650310.27
ENRIC PLADEVALL VILA Abocament ENRIC PLADEVALL VILA - torrent de la Reguera,501106.63,4665295.25
"GUITART PACHECO, JOSEP XAVIER EDAR RUBI",416668.93,4590130.77
"TECNOLOGIAS DEL MEDIO AMBIENTE, SA MANIPULADOS FORESTALES SA (TORRENT DIVUIT)",452402.15,4611962.53
EDAR SILS-VIDRERES EDAR SILS-VIDRERES (SORTIDA),479352.31,4627638.35
"CAN MUNNAR SC -EXPLOTACIÓ RAMADERA- SOLÉS - PAGÈS, SC (RIERA DE PINS)",498582.59,4660775.26
"FUNDICIONES OLOTENSES, SA EDAR OLOT",457959.61,4672318.58
"RECOLLIDA I RECICLATGE, SL  -CR. TARRAGONA- RECOLLIDA I RECICLATGE SL (ABOCAMENT)",437508.36,4643573.69
"SINCROFARM, SL SINCROFARM, SL",423905.85,4578045.7
"TRACTAMENTS I SERVEIS AMBIENTALS VILA, SL FERRAN VILA VILA (SORTIDA DEPURADORA NETEJA CAMIONS)",482833.58,4662928.38
RWE INNOGY IBERIA SLU RWE INNOGY ABOCAMENT PROCÉS I REBUIG,472282.0,4624993.0
"DERMO, SA DERMO SA. (AIGÜES RESIDUALS)",429646.02,4599715.69
"MIRFER, SA MIRFER, SA_2",501203.0,4627021.0
"MOVIGRUP, SA MOVIGRUP SA (SORTIDA DEPURADORA)",376423.32,4650860.17
"CODORNIU, SA CODORNIU SA (PUNT 2_FERTIRRIGACIÓ)",399461.88,4587595.9
"COVESTRO, SL 011900000002 - AB 1",346916.54,4553717.24
AJUNTAMENT DE BLANES (PLANTA TRACTAMENT) EDAR BLANES,480090.2,4613591.32
"FCC CONSTRUCCIÓN, SA FCC CONSTRUCCIÓN, SA (SORTIDA DEPURADORA)",350404.64,4565931.23
"CODORNIU, SA CODORNIU SA (PUNT 1_SORTIDA TRACTAMENT)",399645.88,4587540.89
"OMNIPACK, SL OMNIPACK, SL (ABOCAMENT)",438973.12,4610948.63
"JEAN LEON, SL JEAN LEÓN, SL  (SORTIDA DEPURADORA)",391750.87,4587675.95
"RESINAS EGARA, SL EDAR TERRASSA",419399.98,4596730.76
FUNDACIO CATALANA DE L'ESPLAI 022001000119 - AB 1,388101.0,4659697.0
ASOCIACION DE INVESTIGACION INDUSTRIAS DEL CURTIDO Y ANEXAS ASOCIACIÓN DE INVESTIGACION INDUSTRIAS DEL CURTIDO Y ANEXAS (SORTIDA RESIDUALS),382683.98,4604638.05
"TECNOPIEL, SA TECNOPIEL, SA  (SORTIDA DEPURADORA)",481382.58,4662918.39
"ECO-GIRONINA DE DEPÒSITS, SL ECOGIRONINA DE DIPOSITS, SL (AIGÜES PLUVIALS)",479980.0,4635790.0
CAN BONDIA RESTAURANT SL JACINTO VERDAGUER COLOMER (SORTIDA DEPURADORA),420000.05,4605456.77
"BOSTIK, SA EDAR RUBI",416668.93,4590130.77
CONSELL COMARCAL DE L'ALT EMPORDÀ CONSELL COMARCAL DE L'ALT EMPORDÀ -ZONA ESPORTIVA ELS GORGS- (SORTIDA DEPURADORA),502606.65,4668395.24
"CANALS CUSSO, JOSEP JOSEP CANALS CUSSO (llera)",405436.08,4612649.89
"VALL DE SANTA MAGDALENA, SA VALL DE SANTA MAGDALENA, SA (SORTIDA DEPURADORA)",486506.77,4686895.39
"CELLER EL MAS PUJO, SA CELLER MAS PUJO (RIERA DE LLITRÀ)",389277.78,4575799.96
"TREFAL, SA TREFAL, SA (SORTIDA AIGÜES RESIDUALS)",431286.04,4602265.68
"SCHÜTZ IBÉRICA, SL SCHUTZ IBERICA, SL_Abocament",340005.51,4550796.29
CLUB DE TENIS SANT GERVASI CLUB DE TENIS SANT GERVASI (SORTIDA DEPURADORA),423637.89,4583990.71
"FERRALLES LA GRANOTA, SL ORTEGA PALENZUELA_INFILTRACIÓ SUBSOL",481711.31,4627990.33
"INTIER AUTOMOTIVE EYBL GMBH, S COM. INTIER AUTOMOTIVE, SA",388475.78,4576473.96
"DS SMITH PACKAGING PENEDES, SA CARTONAJES DEL PENEDÉS, S.A. (SORTIDA DEPURADORA)",393405.89,4589895.95
AUTORITAT PORTUÀRIA DE TARRAGONA (NÚM.23) AUTORITAT PORTUÀRIA DE TARRAGONA,352297.0,4552407.0
"TRANSPAIS INTERMODAL, SL MAR _PORT DE TARRAGONA",348847.0,4551023.0
"MECANIZADOS BUSQUÍ, SL POL IND SUD A RIERA RUBI",417405.93,4590795.77
"CARGILL, SLU CARGILL-RIU LLOBREGAT",410861.94,4592918.82
"GESTORA DE RUNES DEL TARRAGONÉS, SL GESTORA DE RUNES DEL TARRAGONÈS( TORRENT)",361658.59,4556476.13
"TERBULUC, SL TERBULUC",353521.56,4554443.19
"COPERFIL OBRAS Y SERVICIOS, SA RIERA DE RAPIOLES COPERFIL GROUP,SA",456527.16,4613135.5
"AMANN SPAIN, SL AA2003001326-BELFIL,SA",395591.21,4632045.99
"SOLUCIONES ALIMENTARIAS R45, SL EDAR LA POBLA DE LILLET",415252.59,4677328.92
"RESANGI, SL RIU SER",468906.59,4666795.49
"LACTIGUST SL LACTIGUST, SL",488133.0,4637722.0
FUNDACIO PRIVADA MONA FUNDACIÓ PRIVADA MONA (SORTIDA DEPURADORA),484864.4,4638912.33
"AFRUSE, SL AFRUSE, SL",344191.0,4557580.0
"SECTOR INDUSTRIAL ""EL FOIX"" SECTOR INDUSTRIAL FOIX (SORTIDA DEPURADORA)",384346.73,4571001.99
"CAMPING MORUNYS, SL RIU CARDENER (CAMPING MORUNYS, SL)",384036.46,4667175.14
"ESCOFET 1886, SA EDAR MARTORELL",410693.94,4592621.82
"CAN CLARENS, SL Abocament CAN CLARENS, SL - Sot de Can Montesell",458226.14,4610345.49
"UNITEX, SA (URX) UNITEX, SA (EDAR)",406954.98,4599770.86
"CA LA ROTLLADA, SL CA LA ROTLLADA, SL",451490.48,4655336.61
"MUNTADA FONT, JOAN -HOSTAL DEL COLL- HOSTAL DEL COLL (ARQUETA RECOLLIDA CUBA)",460620.41,4645247.52
"BASF ESPAÑOLA, SL BASF ESPAÑOLA-Abocament",349955.52,4549821.21
"INDUSTRIAS QUÍMICAS DEL ÓXIDO DE ETILENO, SA ABOC.IND.QUIMICA DEL OXIDO DE ETILENO",348505.52,4550596.23
"DIPÒSIT DE RUNA TERRA NEGRA, SL DIPÒSIT DE RUNA TERRA NEGRA, SL",505971.62,4662940.2
"ALCOVER QUÍMICA, SL Abocament 1 ALCOVER QUÍMICA, SL - Barranc de la Font Major",347750.67,4570721.26
"SERVEIS D'INCINERACIO DE RESIDUS URBANS, SA SIRUSA",351105.56,4555796.21
"SOCIETAT GENERAL D'AIGÜES DE BARCELONA, SA SOCIETAT GENERAL D'AIGÜES DE BARCELONA, SA (REBUIG OSMOSIS)",420405.84,4578195.72
"ASFALTOS ESPAÑOLES, SA ABOCAMENT ASFALTOS ESPAÑOLES, SA (AIGÜES DE PROCÉS, SANITÀRIES, DE NETEJA, PLUVIALS, DESLLASTS VAIXE",349905.53,4551906.22
"E.ON GENERACIÓN, SL Emissari de Repsol Química",349919.52,4550158.21
"INOVYN ESPAÑA, SL ABOCMARMEDITERRANIA (HISPAVIC IBERICA, S.A)",410705.94,4593220.82
"SPOERRY COMAS, ERICH SPOERRY COMAS,ERICH (AIGÜES SANITÀRIES SORTIDA DEPURADORA INFILTRACIÓ)",387009.09,4617541.04
"COMAIGUA, SL (RIUDECANYES) PLANTA POTABILITZADORA AJUNTAMENT DE RIUDECANYES (SORTIDA RENTAT FILTRES)",329069.53,4555261.38
"FRESH WATER NATURE, SL FRESH WATER NATURE, SL - ITAM LLOBREGAT",427270.0,4573081.0
"ROSARIUM MOLLET DE PERELADA, SL  -RESTAURANT MAS RENART- ROSARIUM MOLLET DE PERELADA, SL  -RESTAURANT MAS RENART-  (SORTIDA DEPURADORA EMPRESA)",499939.82,4690622.29
"ESTACION DE SERVICIO CORRAL, SL AA2002000691-EDAR de Rubí",422405.95,4592295.73
"NUPIK INTERNACIONAL, SL NUPIK INTERNACIONAL, SA (SORTIDA AIGÜES RESIDUALS)",430406.02,4599635.68
"MAS MARCÈ, SCP  -PLANTA FORMATGES- MAS MARCÉ, SCP (ARQUETA RECOLLIDA CUBES)",499465.69,4673296.27
"GRUES SANT CELONI, SL ABOCAMENT GRUES SANT CELONI, PLUVIALS HIDROCARBURADES A LLERA",456993.0,4613938.0
"PMT-EUROPE, SL TORRENT DEL MINYÓ INDEL INDUSTRIAL ELECTROLITICA,SA 021992000078",459423.51,4629005.83
"NURI I ESPADALER, SL NURI I ESPADALER, SL (SORTIDA RESIDUALS)",439956.38,4644895.68
"AUTOPISTAS CONCESIONARIA ESPAÑOLA, SAU - PEATGE DE BANYERES AUTOPISTAS CONCESIONARIA ESPAÑOLA, SAU: BARRANC INNOMINAT",377194.71,4569755.04
"BATALLA BUSQUETS, JOSEP MARIA JOSEP MARIA BATALLA BUSQUETS (SORTIDA DEPURADORA)",463292.3,4629533.48
"SCHÜTZ IBÉRICA, SL SCHUTZ IBERICA_Abocament",356855.74,4578146.2
"MACH VALLS, ANTONI ANTONI MACH VALLS - RESTAURANT : INFILTRACIÓ AL TERRENY",475363.79,4692012.48
"IMPRO LACORTE, SL IMPRO LACORTE SL (SORTIDA DEPURADORA)",467976.24,4620345.43
JUNTA COMPENSACIÓN UDAD ACTUACIÓN Z RES. OLIVELLA JUNTA DE COMPENSACIÓ ZONA RESIDENCIAL OLIVELLA (SORTIDA DEPURADORA),404748.76,4571197.83
"FCC CONSTR. I SERVIÀ CANTÓ, SA (UTE VAR. VALLIRANA) UTE VALLIRANA (SORTIDA TRACTAMENT FÍSICOQUÍMIC)",411683.86,4582209.8
"PLASTERLINK - INVEST, SL ABOCAMENT PLASTERLINK - INVEST, SL (SANITÀRIES)",418558.94,4591290.76
AJUNTAMENT DE SANT ESTEVE SESROVIRES - POL.IND. ANOIA POLÍGON INDUSTRIAL ANOIA_SANT ESTEVE SESROVIRES (SORTIDA DEPURADORA),405867.92,4591922.85
"DISTRIBUCIONS FIGUERES, SL DISTRIBUCIONS FIGUERAS, SL (SORTIDA DEPURADORA)",506236.79,4686000.24
"CONFIGIRONA, SA CONFIGIRONA, SA  (SORTIDA AIGÜES PLUJANES + REFRIGERACIÓ)",472659.0,4646705.0
"LES AMFORES NATURA, SL LES AMFORES NATURA (RIERA DE VILALLEONS)",442471.0,4638240.0
"GARCÍA GONZÁLEZ, ROSA ROSA GARCIA GONZALEZ: INFILTRACIÓ",475006.0,4660295.0
"RETEVISION I, S.A.U. Centre radioenlace Retevisión",407905.8,4574795.81
"RESTAURANT CAN RASPALL, SCP Abocament 021998000972",442406.01,4596295.58
"2 GRAUS 2009, SL -RESTAURANT MAS TARRÉ- Abocament RESTAURANT MAS TARRE SCP - riera Gotarra",491863.34,4629696.26
"HERAS COLOMER, NÚRIA NÚRIA HERAS COLOMER (SORTIDA PRETRACTAMENT)",505372.53,4652008.19
"ECO-GIRONINA DE DEPÒSITS, SL ECOGIRONINA DE DIPÒSITS, SL (AIGÜES DOMÈSTIQUES INFILTRACIÓ TERRENY)",479830.0,4635620.0
"CHARLOT EDMOND, MICHAEL MICHAEL CHARLOT EDMOND: INFILTRACIÓ EN EL TERRENY",514518.0,4655841.0
"FORTEA FABRA, JOSEP I FRANCES WEBSTER, DIANAN DIANA FRANCES WEBSTER: INFILTRACIÓ EN EL TERRENY",514537.0,4655871.0
"INDUSTRIAS VALLS 1, SA ABOCAMENT INDUSTRIAS VALLS 1 (AIGÜES DE PROCÉS I REFRIGERACIÓ-C/CERVANTES)",384289.98,4604345.04
"CASTILLO MATEO, JOSE MANUEL CASTILLO MATEO, JOSÉ MANUEL (SORTIDA SANITÀRIES I DE PROCÉS)",430616.96,4591920.67
"CAMPSA ESTACIONES DE SERVICIO, SA (MARGE DRET) EESS CAMPSA NÚM. 96283 MARGE DRET (SANTA AGNÈS): RIU MOGENT",445145.0,4604679.0
"GRESLAND CERAMIC, SL GRESLAND CERAMIC, SL",493358.0,4687387.0
FUNDACIÓ PRIVADA ONYAR-LA SELVA FUNCIÓ PRIVADA ONYAR-LA SELVA (SORTIDA FOSSA SÈPTICA),486780.0,4643913.0
"CAMPSA ESTACIONES DE SERVICIO, SA (MARGE DRET) EESS CAMPSA NÚM. 96282 ESQUERRE (SANTA AGNÈS): RIU MOGENT",445238.08,4604850.58
"AREAS, SA  (ÀREA DE LA TORDERA) AREAMED 2000, S.A E.S DE TORDERA (SORTIDA TRACTAMENT)",476412.0,4612986.35
CAN SURIOL (JOSEP CAMPS ROVIROSA) JOSEP CAMPS ROVIROSA (CAN SURIOL) (SORTIDA DEPURADORA),398884.78,4574069.88
"PROPERLY, SA -  E.S. AVENIDA DEL MAR PROPERLY, SA E.S. AVENIDA DEL MAR (RASA FILTRANT)",514217.45,4639475.11
"PROPERLY, SA -  E.S. AVENIDA DEL MAR E.S PROPERLY, S.A E.S AVENIDA MAR (RASA HIDROCARBURADES)",514205.45,4639472.11
"IT-3, SA IT-3, SA (SORTIDA AIGÜES RESIDUALS)",436116.14,4614357.66
"PERE ROCA, SA Abocament PERE ROCA,SA - riera de Bell-lloc",510003.41,4635319.13
"ALAMEDA-TORRENT, SLU ALAMEDA-TORRENT, SLU (SORTIDA DEPURADORA SANITÀRIES I NETEJA MAQUINÀRIA)",488572.39,4636299.3
"CAMPING VIDAL PARC, SL AGROPECUARIA GRAU: INFILTRACIÓ",456780.29,4629569.53
CEDIPSA (E.S.BELLATERRA I-II) ES BELLATERRA I (SORTIDA TRACTAMENT),424641.97,4593648.71
CEDIPSA (E.S.BELLATERRA I-II) ES BELLATERRA II (SORTIDA TRACTAMENT),424975.97,4593568.71
"SUREDA NOGUÉ, JOSEP (GARATGE SUREDA) Abocament JOSEP SUREDA NOGUE (GARATGE SUREDA) - torrent d'Esplet",476856.32,4630125.37
AJUNTAMENT DE SANTA COLOMA DE FARNERS AJUNTAMENT DE SANTA COLOMA DE FARNERS (CASTELL DE FARNERS) (SORTIDA DEPURADORA),469558.34,4634307.44
AJUNTAMENT DE GUALBA (NUCLI URBÀ CAN PLA) AJUNTAMENT DE GUALBA - NUCLI URBÀ DE CAN PLA (SORTIDA DEPURADORA),461448.0,4618600.0
"EXPLOTACIONES AGRICOLAS Y FORESTALES BRUGAROL, SA  -CELLER- EXPLOTACIONES AGRICOLAS Y FORESTALES BRUGAROL, SA (SORTIDA DEPURADORA EMPRESA)",509058.42,4636418.14
CASA CAL FAINÉ TORRENT DEL RUBIO (afluent del riu Llobregat),405756.1,4615095.89
AJUNTAMENT DE SANT CUGAT AJUNTAMENT DE SANT CUGAT DEL VALLÈS (RIERA DE VOLPALLERES),422396.96,4593618.73
COMUNITAT USUARIS ABOCAMENT EDAR FAR EMPORDA COMUNITAT D'USUARIS ABOCAMENT EDAR FAR D'EMPORDÀ (SORTIDA DEPURADORA),500154.71,4676796.27
"AGROMONISTROLET, SL - CELLER EL MOLÍ ABOCAMENT 1 (AGROMONISTROLET, SL) INFILTRACIÓ SUBSÒL",398570.13,4621126.95
"DEP.TREBALL, AFERS SOCIALS I FAMÍLIES (RESIDÈNCIA DE GENT GRAN DE TERRASSA) 021999005068 - AB 1",419835.0,4603747.0
"GERMANS MONTSANT, SC (RESTAURANT BELL-LLOC) GERMANS MONTSAN, SC (SORTIDA TRACTAMENT)",459546.26,4625051.5
"AUTOPISTAS CONCESIONARIA ESPAÑOLA, SAU AUTOPISTAS CONCESIONARIA ESPAÑOLA, SAU -MAÇANET- (SORT. TRACTAMENT)",478916.3,4625991.35
"G&P LA ROQUETA 21, S.L. AA2003000015 ASSE-INM-FARMA (Golf la Roqueta, Castellgalí)",403106.1,4615545.91
"AUTOPISTAS CONCESIONARIA ESPAÑOLA, SAU AUTOPISTAS CONCESIONARIA ESPAÑOLA, SAU (PEATG. MAÇANET)",478915.3,4625991.35
"CULUBRET MELCIÓ, ENRIQUETA -MAS MOLINÀS- ENRIQUETA CULUBRET MELCIÓ (SORTIDA TRACTAMENT)",479428.48,4649827.39
"AUTOPISTES DE CATALUNYA, SA AUTOPISTES DE CATALUNYA, SA (PEATGE CUBELLES)- SORTIDA DEPURADORA",387558.67,4562463.95
JUNTA DE COMPENSACIO PLA PARCIAL SECTOR LA GOBA DE VIDRERES ABOC. JUNTA COMPENSACIO PLA PARCIAL SECTOR LA GOBA DE VIDRERES - RIERA RECLAR,483906.31,4626845.32
"GARVE , SA 022001000236 - AB 1",387905.94,4597796.0
"INSTITUTO GRIFOLS, SA (II) INSTITUTO GRÍFOLS, SA (SORTIDA RESIDUALS)",436978.05,4602859.64
"AUTOPISTAS CONCESIONARIA ESPAÑOLA, SAU - PEATGE DE LA BISBAL DEL PENEDÈS AUTOPISTAS CONCESIONARIAS ESPAÑOLA, SAU (PEATGE ALBORNAR)",374233.71,4570917.06
"AUTOPISTAS CONCESIONARIA ESPAÑOLA, SAU AUTOPISTAS CONCESIONARIA ESPAÑOLA, SAU (PK 126,4), SORTIDA DEPURADORA",444558.09,4605389.58
CENTRE DE TELECOMUNICACIONS A MONISTROL DE MONTSERRAT AA2003002170 MONTSERRAT,401325.03,4606563.91
GOLF HOTEL F&G LA FIGUEROLA GOLF HOTEL F&G LA FIGUEROLA:  BARRANC DE LA GOMALA,316178.43,4544793.46
"AUTOPISTAS CONCESIONARIA ESPAÑOLA, SAU AUTOPISTAS CONCESIONARIA ESPAÑOLA, SAU (SORTIDA TRACTAMENT 4)",408951.93,4592061.83
"JANE PARRIS, BELINDA Abocament MAS L'AVENC (BELINDA JANE PARRIS LITTLER) - infiltració al terreny",453734.0,4650372.0
"AUTOPISTAS CONCESIONARIA ESPAÑOLA, SAU AUTOPISTAS CONCESIONARIA ESPAÑOLA, SAU (SORTIDA TRACTAMENT 5)",408954.93,4592055.83
"AUTOPISTAS CONCESIONARIA ESPAÑOLA, SAU AUTOPISTAS CONCESIONARIA ESPAÑOLA, SAU (SORTIDA TRACTAMENT 1)",408985.93,4592014.83
"ESTACIÓ DE SERVEI VALLGORGUINA, SL REPSOL COMERCIAL DE PRODUCTOS PETROLÍFEROS SA - ES 12.543 VALLGORGUINA (SORTIDA DEPURADORA)",459856.15,4610320.47
LLAR D'INFANTS MUNICIPAL DE DOSRIUS LLAR D'INFANTS MUNICIPAL DOSRIUS (SORTIDA DEPURADORA),451233.09,4604825.53
EDAR URB. PARC RESIDENCIAL CATALUNYA -ELS ALEMANYS- EDAR URB. PARC RESIDENCIAL CATALUNYA -ELS ALEMANYS-  (SORTIDA AIGUA TRACTADA),502639.67,4671172.24
AJUNTAMENT D'HOSTALETS DE PIEROLA AJUNTAMENT D'HOSTALETS DE PIEROLA_POLÍGON INDUSTRIAL MAS D'EN PI (SORTIDA DEPURADORA),399165.0,4602765.92
"HOTEL MAS LA FERRERIA, SL RIERA DE STA. MARGARIDA",454141.0,4673012.0
"CATUAV, SL TORRENT AFLUENT TORRENT GOMAR",430452.0,4628872.0
"ESCORXADOR FRIGORIFIC DE L'ALT CAMP, SL EDAR VALLS",352105.68,4570261.23
"COMAIGUA, SL SECOMSA AIGÜES, SL (LLERA-RIERA D'ALFORJA)",332559.58,4561267.36
"SYL CREACIONES GRAFICAS Y PUBLICITARIAS, SA SYL, CREACIONES GRÁFICAS Y PUBLICITARIAS, SA (SORTIDA RESIDUALS)",424030.85,4578695.7
"AUTOPISTAS CONCESIONARIA ESPAÑOLA, SAU AUTOPISTAS CONCESIONARIA ESPAÑOLA, SAU (TORREDEMBARRA) SORTIDA SUD",364970.6,4557674.11
"AUTOPISTAS CONCESIONARIA ESPAÑOLA, SAU AUTOPISTAS CONCESIONARIA ESPAÑOLA, SAU (TORREDEMBARRA) SORTIDA NORD",365124.6,4557783.11
"AUTOPISTAS CONCESIONARIA ESPAÑOLA, SAU AUTOPISTAS CONCESIONARIA ESPAÑOLA, SAU (TORREDEMBARRA)",365195.6,4557708.11
"AUTOPISTAS CONCESIONARIA ESPAÑOLA, SAU AUTOPISTAS CONCESIONARIA ESPAÑOLA (PEATGE AP-2): BARRANC INNOMINAT",346295.0,4583483.0
"CANTERAS VALSAN, SA (RA-MONTJUÏC-AMPLIACIÓ II) CANTERAS VALSAN, SA (MONTJUIC)",408690.0,4618180.0
"SANDOZ INDUSTRIAL PRODUCTS, SA EDAR PINEDA DE MAR",473445.16,4609486.37
AJUNTAMENT DE VANDELLOS I HOSPITALET DE L'INFANT (REFUGI) REFUGI ESPORTIU,317659.0,4544703.0
"REPUESTOS SAN ESTEBAN, SL EDAR SANT JAUME DELS DOMENYS (PAPIOLET)",376811.72,4570769.04
"CEDIPSA, CIA. DIST. PETROLEO, SA CEDIPSA - VILASECA II (AIGÜES HIDROCARBURADES)",341508.52,4551279.28
CLUB DE GOLF CAMPRODON CLUB DE GOLF CAMPRODON  (SORTIDA SOBREEIXIDOR FOSSA SÈPTICA),448857.0,4684746.0
"CEDIPSA, CIA. DIST. PETROLEO, SA CEDIPSA - VILASECA (2) (AIGÜES SANITÀRIES)",341509.52,4551279.28
"ERCROS, SA - VILA-SECA 1 ERCROS - VILASECA I (SORTIDA TRACTAMENT)",348426.51,4548925.22
"TOTAL PETROCHEMICALS IBÈRICA, SLU TOTAL PETROCHEMICALS IBERICA SLU (SORTIDA SANITÀRIES I INDUSTRIALS_SORTIDA 2)",427247.82,4573614.66
"TOTAL PETROCHEMICALS IBÈRICA, SLU TOTAL PETROCHEMICALS IBERICA SLU (SORTIDA SANITÀRIES I INDUSTRIALS_SORTIDA 1)",427248.82,4573614.66
"CLOT PUIG, XAVIER  -CASA SANT ANDREU DE BANCELLS- FRANCISCO JAVIER CLOT PUIG (SORTIDA TRACTAMENT)",454141.38,4642655.57
"AUTOPISTAS CONCESIONARIA ESPAÑOLA, SAU AUTOPISTAS CONCESIONARIA ESPAÑOLA, SAU -SANT JULIÀ DE RAMIS (SORTIDA TRACTAMENT)",485621.51,4653314.34
ANA Mª BORREDÀ HOMET ANNA M BORREDA HOMET,478556.56,4660495.41
"AUTOPISTAS CONCESIONARIA ESPAÑOLA, SAU AUTOPISTAS CONCESIONARIAS ESPAÑOLA, SAU   (PEATGE SANT CELONI), SORTIDA DEPURADORA",456962.0,4613836.5
"EUROAYCA, SL  -CLUB DE POLO SANT ANTONI DE VILADRAU- FINCA MAS VIDAL (SORTIDA DEPURADORA)",446386.3,4633515.61
"ISODURI, SL EDAR DE SEVA",439924.28,4632244.66
"ERCROS, SA ERCROS - TARRAGONA",349894.52,4549860.21
"AUTOPISTAS CONCESIONARIA ESPAÑOLA, SAU AUTOPISTAS CONCESIONARIA ESPAÑOLA, SAU -BORRASSÀ (SORTIDA TRACTAMENT)",495275.69,4674810.3
"AUTOPISTAS CONCESIONARIA ESPAÑOLA, SAU AUTOPISTAS CONCESIONARIA ESPAÑOLA, SAU  (PEATGE HOSTALRIC)",470519.25,4621168.41
"CASADELLÀ SURROCA, EDUARD- MAS CASADELLÀ EDUARD CASADELLÀ SURROCA",505414.0,4652501.0
"MAS VILA, SCP (CASA RURAL) MAS VILA (SORTIDA DEPURADORA)",430730.33,4640891.74
"PINTER CAIPO, SA Abocament PINTER, SA - infiltració",403511.17,4624645.92
CEDIPSA E.S. EMPORDÀ NÚM. 31573 (SORTIDA SEPARADOR D'HIDROCARBURS),494351.65,4669077.3
"GERMANS RIERA PEREZ, SL (RESTAURANT CAN CARBONELL) TORRENT DE SANT JUST (ZONA DE CAN CARBONELL)",423664.89,4583517.71
"INICIATIVAS NAMBE, SL INICIATIVAS NAMBE, SL (SORTIDA DEPURADORA)",475771.33,4630827.38
"FRIGORÍFIC SANTA COLOMA, SLU ABOC. REFRIGERACIÓ INDUSTRIAS MAYNOU, SA",472435.34,4633500.41
"CAN BARRI CAN BARRI, SCP (SORTIDA TRACTAMENT)",396836.37,4652145.02
"BUGADERIA L'EMPORDÀ, SA BUGADERIA L'EMPORDÀ, SA  (SORTIDA PROCÉS ARQUETA EXTERNA)",502623.48,4646123.2
"GRAMONA, SA GRAMONA, SA  (SORTIDA DE LA DEPURADORA)",397397.87,4586763.91
CONSELL COMARCAL DEL BARCELONÈS (ATENCIÓ ANIMALS DE COMPANYIA) CENTRE COMARCAL D'ATENCIÓ D'ANIMALS DE COMPANYIA DEL BARCELONÈS (SORTIDA DEPURADORA),438650.96,4590634.6
"ASDARA MOBILIARI, SA 021999001782 TORRENT DE GASERANS",467276.23,4620090.43
"CONSTRUCCIONS FUSTÉ, SA  -RIUDELLOTS- CONSTRUCCIONS FUSTÉ (EDAR)",483394.97,4638998.73
"CONSTRUCCIONS FUSTÉ, SA  -RIUDELLOTS- CONSTRUCCIONS FUSTÉ S.A (decantador i separador d'hidrocarburs)",483356.4,4638897.34
FUNDACIÓ VIDABONA (ALBERG) FUNDACIÓ VIDABONA_ALBERG,437680.0,4678556.0
DEPARTAMENT AGRICULTURA RAMADERIA I PESCA (INCAVI) EDAR DE REUS,342053.54,4554552.28
